### ISSUE TITLE
proxychains do not take effect on system netbsd9.2  ?

### ISSUE THREAD

**Issue by bettswang** [rofl0r/proxychains-ng#417]
**After modified the Makefile with deletion -ldl (refer to #416), I had compeletly installed proxychains . And I wanted to make a test. It failed. The result seems that data isn't redirected to the proxy. To make sure that,  run tcpdump to caputure the packet. It is direct to the Internet. The proxy server is OK ,  I have test on ubuntu20.04, it wok all right.**

```
localhost# tail -n 2 /etc/proxychains.conf
socks5  192.168.3.1 1080

localhost# proxychains4 telnet www.google.com 80
[proxychains] config file found: /etc/proxychains.conf
[proxychains] preloading /usr/lib/libproxychains4.so
Trying 2001::caa0:8276...
telnet: Connect to address 2001::caa0:8276: : No route to host
Trying 199.59.150.43...
telnet: Unable to connect to remote host
bash-5.1#

localhost# tcpdump -nn -i wm0  'tcp and (not  port 22)'
tcpdump: verbose output suppressed, use -v or -vv for full protocol decode
listening on wm0, link-type EN10MB (Ethernet), capture size 262144 bytes
17:16:12.532195 IP 192.168.3.131.65510 > 199.59.150.43.80: Flags [S], seq 2308636755, win 32768, options [mss 1460,nop,wscale 3,sackOK,TS val 1 ecr 0], length 0
17:16:18.537856 IP 192.168.3.131.65510 > 199.59.150.43.80: Flags [S], seq 2308636755, win 32768, options [mss 1460,nop,wscale 3,sackOK,TS val 13 ecr 0], length 0
17:16:19.696360 IP 199.59.150.43.80 > 192.168.3.131.65511: Flags [R.], seq 148449733, ack 2639979375, win 64240, length 0
17:16:30.542239 IP 192.168.3.131.65510 > 199.59.150.43.80: Flags [S], seq 2308636755, win 32768, options [mss 1460,nop,wscale 3,sackOK,TS val 37 ecr 0], length 0
17:16:33.540493 IP 199.59.150.43.80 > 192.168.3.131.65510: Flags [R.], seq 78407076, ack 2308636756, win 64240, length 0

root@ubuntu2004:~# proxychains telnet www.google.com 80
ProxyChains-3.1 (http://proxychains.sf.net)
|DNS-request| www.google.com
|S-chain|-<>-192.168.3.1:1080-<><>-4.2.2.2:53-<><>-OK
|DNS-response| www.google.com is 142.250.196.132
Trying 142.250.196.132...
|S-chain|-<>-192.168.3.1:1080-<><>-142.250.196.132:80-<><>-OK
Connected to www.google.com.
Escape character is '^]'.




```

**Comment by rofl0r** [comment]
please `make clean`, then add `CFLAGS+=-DDEBUG` to your config.mak and run make again, then run e.g. `proxychains4 curl google.com`.

**Comment by bettswang** [comment]
Reinstall with lastest tar packeage while use git clone from master code last time, it work fine now. I didn't know what is different?
